demo/bloom/gemm_config.in
batch_size, seq_len, head_num, size_per_head dataType ### batchCount, n, m, k, algoId, customOption, tile, numSplitsK, swizzle, reductionScheme, workspaceSize, stages, exec_time
16 150 32 128 1 ### 1 6144 2400 4096 21 0 24 1 0 0 0 0 1.110753
16 150 32 128 1 ### 256 160 160 128 99 -1 -1 -1 -1 -1 -1 -1 0.116670
16 150 32 128 1 ### 256 128 160 160 99 -1 -1 -1 -1 -1 -1 -1 0.067530
16 150 32 128 1 ### 1 4096 2400 2048 21 0 23 1 0 0 0 0 0.393042
16 150 32 128 1 ### 1 8192 2400 4096 21 0 23 1 0 0 0 0 1.485087
16 150 32 128 1 ### 1 4096 2400 8192 99 -1 -1 -1 -1 -1 -1 -1 1.534080
16 1 32 128 1 ### 1 6144 16 4096 108 -1 -1 -1 -1 -1 -1 -1 0.077460
16 1 32 128 1 ### 1 4096 16 2048 21 0 5 0 0 0 0 20 0.030208
16 1 32 128 1 ### 1 8192 16 4096 21 0 15 1 0 0 0 0 0.091638
16 1 32 128 1 ### 1 4096 16 8192 21 0 15 15 0 1 256 0 0.094495
16 1 32 128 1 ### 1 125440 16 4096 99 -1 -1 -1 -1 -1 -1 -1 1.233300
